No.     Time           Source                Destination           Protocol Length Info
     80 2.353506       155.135.137.109       95.194.167.108        HTTP     203    POST /api/data HTTP/1.1  (application/x-www-form-urlencoded)

Frame 80: 203 bytes on wire (1624 bits), 220 bytes captured (1760 bits) on interface unknown, id 1
Ethernet II, Src: cd:df:f9:39:7b:9e (cd:df:f9:39:7b:9e), Dst: 6b:20:e0:df:52:64 (6b:20:e0:df:52:64)
    Destination: 6b:20:e0:df:52:64 (6b:20:e0:df:52:64)
        Address: 6b:20:e0:df:52:64 (6b:20:e0:df:52:64)
        .... ..1. .... .... .... .... = LG bit: Locally administered address (this is NOT the factory default)
        .... ...1 .... .... .... .... = IG bit: Group address (multicast/broadcast)
    Source: cd:df:f9:39:7b:9e (cd:df:f9:39:7b:9e)
    Type: IPv4 (0x0800)
    Trailer: 707b6f6d675f796f755f646964
    Frame check sequence: 0x5f69747d [unverified]
    [FCS Status: Unverified]
Internet Protocol Version 4, Src: 155.135.137.109, Dst: 95.194.167.108
Transmission Control Protocol, Src Port: 25563, Dst Port: 80, Seq: 0, Len: 149
    Source Port: 25563
    Destination Port: 80
    [Stream index: 3]
    [Conversation completeness: Incomplete (9)]
    [TCP Segment Len: 149]
    Sequence Number: 0    (relative sequence number)
    Sequence Number (raw): 0
    [Next Sequence Number: 150    (relative sequence number)]
    Acknowledgment Number: 0
    Acknowledgment number (raw): 0
    0101 .... = Header Length: 20 bytes (5)
    Flags: 0x002 (SYN)
    Window: 8192
    [Calculated window size: 8192]
    Checksum: 0x7991 [unverified]
    [Checksum Status: Unverified]
    Urgent Pointer: 0
    [Timestamps]
    [SEQ/ACK analysis]
    TCP payload (149 bytes)
    TCP segment data (5 bytes)
Hypertext Transfer Protocol
    POST /api/data HTTP/1.1\r\n
    Content-Length: 27\r\n
    Content-Type: application/x-www-form-urlencoded\r\n
    Host: secure929.org\r\n
    \r\n
    [Full request URI: http://secure929.org/api/data]
    [HTTP request 1/1]
    File Data: 27 bytes
HTML Form URL Encoded: application/x-www-form-urlencoded
    Form item: "user" = "MIKE"
        Key: user
        Value: MIKE
    Form item: "password" = "Mike"
        Key: password
        Value: Mike
    Form item: "fla" = ""
        Key: fla
        Value: 

No.     Time           Source                Destination           Protocol Length Info
     96 4.707011       100.149.75.96         30.176.248.224        HTTP     113    GET / HTTP/1.1 

Frame 96: 113 bytes on wire (904 bits), 113 bytes captured (904 bits) on interface unknown, id 1
Ethernet II, Src: 05:a0:de:25:09:ea (05:a0:de:25:09:ea), Dst: 2c:a4:e6:0f:01:20 (2c:a4:e6:0f:01:20)
    Destination: 2c:a4:e6:0f:01:20 (2c:a4:e6:0f:01:20)
        Address: 2c:a4:e6:0f:01:20 (2c:a4:e6:0f:01:20)
        .... ..0. .... .... .... .... = LG bit: Globally unique address (factory default)
        .... ...0 .... .... .... .... = IG bit: Individual address (unicast)
    Source: 05:a0:de:25:09:ea (05:a0:de:25:09:ea)
    Type: IPv4 (0x0800)
Internet Protocol Version 4, Src: 100.149.75.96, Dst: 30.176.248.224
Transmission Control Protocol, Src Port: 49165, Dst Port: 80, Seq: 0, Len: 59
    Source Port: 49165
    Destination Port: 80
    [Stream index: 6]
    [Conversation completeness: Incomplete (9)]
    [TCP Segment Len: 59]
    Sequence Number: 0    (relative sequence number)
    Sequence Number (raw): 0
    [Next Sequence Number: 60    (relative sequence number)]
    Acknowledgment Number: 0
    Acknowledgment number (raw): 0
    0101 .... = Header Length: 20 bytes (5)
    Flags: 0x002 (SYN)
    Window: 8192
    [Calculated window size: 8192]
    Checksum: 0x3c6b [unverified]
    [Checksum Status: Unverified]
    Urgent Pointer: 0
    [Timestamps]
    [SEQ/ACK analysis]
    TCP payload (59 bytes)
Hypertext Transfer Protocol
    GET / HTTP/1.1\r\n
    Content-Length: 0\r\n
    Host: www.google.com\r\n
    \r\n
    [Full request URI: http://www.google.com/]
    [HTTP request 1/1]
    [Response in frame: 98]

No.     Time           Source                Destination           Protocol Length Info
     98 4.774704       30.176.248.224        100.149.75.96         HTTP     178    HTTP/1.1 200 OK 

Frame 98: 178 bytes on wire (1424 bits), 178 bytes captured (1424 bits) on interface unknown, id 1
Ethernet II, Src: 07:36:a9:cc:97:0d (07:36:a9:cc:97:0d), Dst: 4e:58:62:ff:08:7c (4e:58:62:ff:08:7c)
    Destination: 4e:58:62:ff:08:7c (4e:58:62:ff:08:7c)
        Address: 4e:58:62:ff:08:7c (4e:58:62:ff:08:7c)
        .... ..1. .... .... .... .... = LG bit: Locally administered address (this is NOT the factory default)
        .... ...0 .... .... .... .... = IG bit: Individual address (unicast)
    Source: 07:36:a9:cc:97:0d (07:36:a9:cc:97:0d)
    Type: IPv4 (0x0800)
Internet Protocol Version 4, Src: 30.176.248.224, Dst: 100.149.75.96
Transmission Control Protocol, Src Port: 80, Dst Port: 49165, Seq: 0, Len: 124
    Source Port: 80
    Destination Port: 49165
    [Stream index: 6]
    [Conversation completeness: Incomplete (9)]
    [TCP Segment Len: 124]
    Sequence Number: 0    (relative sequence number)
    Sequence Number (raw): 0
    [Next Sequence Number: 125    (relative sequence number)]
    Acknowledgment Number: 0
    Acknowledgment number (raw): 0
    0101 .... = Header Length: 20 bytes (5)
    Flags: 0x002 (SYN)
    Window: 8192
    [Calculated window size: 8192]
    Checksum: 0x8276 [unverified]
    [Checksum Status: Unverified]
    Urgent Pointer: 0
    [Timestamps]
    [SEQ/ACK analysis]
    TCP payload (124 bytes)
Hypertext Transfer Protocol
    HTTP/1.1 200 OK\r\n
    Content-Length: 48\r\n
    Date: Sat, 19 Oct 2024 10:24:52 GMT\r\n
    \r\n
    [HTTP response 1/1]
    [Time since request: 0.067693000 seconds]
    [Request in frame: 96]
    [Request URI: http://www.google.com/]
    File Data: 48 bytes
    Data (48 bytes)

0000  3c 68 74 6d 6c 3e 3c 62 6f 64 79 3e 3c 68 31 3e   <html><body><h1>
0010  48 65 6c 6c 6f 2c 20 57 6f 72 6c 64 21 3c 2f 68   Hello, World!</h
0020  31 3e 3c 2f 62 6f 64 79 3e 3c 2f 68 74 6d 6c 3e   1></body></html>

No.     Time           Source                Destination           Protocol Length Info
    102 6.276015       227.40.48.122         16.208.141.189        HTTP     113    GET / HTTP/1.1 

Frame 102: 113 bytes on wire (904 bits), 113 bytes captured (904 bits) on interface unknown, id 1
Ethernet II, Src: 08:ae:55:16:21:c5 (08:ae:55:16:21:c5), Dst: f5:02:bf:90:6d:88 (f5:02:bf:90:6d:88)
    Destination: f5:02:bf:90:6d:88 (f5:02:bf:90:6d:88)
        Address: f5:02:bf:90:6d:88 (f5:02:bf:90:6d:88)
        .... ..0. .... .... .... .... = LG bit: Globally unique address (factory default)
        .... ...1 .... .... .... .... = IG bit: Group address (multicast/broadcast)
    Source: 08:ae:55:16:21:c5 (08:ae:55:16:21:c5)
        Address: 08:ae:55:16:21:c5 (08:ae:55:16:21:c5)
        .... ..0. .... .... .... .... = LG bit: Globally unique address (factory default)
        .... ...0 .... .... .... .... = IG bit: Individual address (unicast)
    Type: IPv4 (0x0800)
Internet Protocol Version 4, Src: 227.40.48.122, Dst: 16.208.141.189
Transmission Control Protocol, Src Port: 12740, Dst Port: 80, Seq: 0, Len: 59
    Source Port: 12740
    Destination Port: 80
    [Stream index: 9]
    [Conversation completeness: Incomplete (9)]
    [TCP Segment Len: 59]
    Sequence Number: 0    (relative sequence number)
    Sequence Number (raw): 0
    [Next Sequence Number: 60    (relative sequence number)]
    Acknowledgment Number: 0
    Acknowledgment number (raw): 0
    0101 .... = Header Length: 20 bytes (5)
    Flags: 0x002 (SYN)
    Window: 8192
    [Calculated window size: 8192]
    Checksum: 0xe00a [unverified]
    [Checksum Status: Unverified]
    Urgent Pointer: 0
    [Timestamps]
    [SEQ/ACK analysis]
    TCP payload (59 bytes)
Hypertext Transfer Protocol
    GET / HTTP/1.1\r\n
    Content-Length: 0\r\n
    Host: www.google.com\r\n
    \r\n
    [Full request URI: http://www.google.com/]
    [HTTP request 1/1]
    [Response in frame: 103]

No.     Time           Source                Destination           Protocol Length Info
    103 6.318169       16.208.141.189        227.40.48.122         HTTP     178    HTTP/1.1 200 OK 

Frame 103: 178 bytes on wire (1424 bits), 178 bytes captured (1424 bits) on interface unknown, id 1
Ethernet II, Src: b8:94:c0:77:4e:14 (b8:94:c0:77:4e:14), Dst: 54:63:7a:a2:27:51 (54:63:7a:a2:27:51)
    Destination: 54:63:7a:a2:27:51 (54:63:7a:a2:27:51)
        Address: 54:63:7a:a2:27:51 (54:63:7a:a2:27:51)
        .... ..0. .... .... .... .... = LG bit: Globally unique address (factory default)
        .... ...0 .... .... .... .... = IG bit: Individual address (unicast)
    Source: b8:94:c0:77:4e:14 (b8:94:c0:77:4e:14)
        Address: b8:94:c0:77:4e:14 (b8:94:c0:77:4e:14)
        .... ..0. .... .... .... .... = LG bit: Globally unique address (factory default)
        .... ...0 .... .... .... .... = IG bit: Individual address (unicast)
    Type: IPv4 (0x0800)
Internet Protocol Version 4, Src: 16.208.141.189, Dst: 227.40.48.122
Transmission Control Protocol, Src Port: 80, Dst Port: 12740, Seq: 0, Len: 124
    Source Port: 80
    Destination Port: 12740
    [Stream index: 9]
    [Conversation completeness: Incomplete (9)]
    [TCP Segment Len: 124]
    Sequence Number: 0    (relative sequence number)
    Sequence Number (raw): 0
    [Next Sequence Number: 125    (relative sequence number)]
    Acknowledgment Number: 0
    Acknowledgment number (raw): 0
    0101 .... = Header Length: 20 bytes (5)
    Flags: 0x002 (SYN)
    Window: 8192
    [Calculated window size: 8192]
    Checksum: 0x2616 [unverified]
    [Checksum Status: Unverified]
    Urgent Pointer: 0
    [Timestamps]
    [SEQ/ACK analysis]
    TCP payload (124 bytes)
Hypertext Transfer Protocol
    HTTP/1.1 200 OK\r\n
    Content-Length: 48\r\n
    Date: Sat, 19 Oct 2024 10:24:52 GMT\r\n
    \r\n
    [HTTP response 1/1]
    [Time since request: 0.042154000 seconds]
    [Request in frame: 102]
    [Request URI: http://www.google.com/]
    File Data: 48 bytes
    Data (48 bytes)

0000  3c 68 74 6d 6c 3e 3c 62 6f 64 79 3e 3c 68 31 3e   <html><body><h1>
0010  48 65 6c 6c 6f 2c 20 57 6f 72 6c 64 21 3c 2f 68   Hello, World!</h
0020  31 3e 3c 2f 62 6f 64 79 3e 3c 2f 68 74 6d 6c 3e   1></body></html>

No.     Time           Source                Destination           Protocol Length Info
    104 6.668266       57.132.12.164         119.60.94.114         HTTP     203    POST /api/data HTTP/1.1  (application/x-www-form-urlencoded)[Packet size limited during capture]

Frame 104: 203 bytes on wire (1624 bits), 194 bytes captured (1552 bits) on interface unknown, id 1
Ethernet II, Src: 61:11:cb:e3:16:28 (61:11:cb:e3:16:28), Dst: 4b:1a:c3:a1:0e:34 (4b:1a:c3:a1:0e:34)
    Destination: 4b:1a:c3:a1:0e:34 (4b:1a:c3:a1:0e:34)
        Address: 4b:1a:c3:a1:0e:34 (4b:1a:c3:a1:0e:34)
        .... ..1. .... .... .... .... = LG bit: Locally administered address (this is NOT the factory default)
        .... ...1 .... .... .... .... = IG bit: Group address (multicast/broadcast)
    Source: 61:11:cb:e3:16:28 (61:11:cb:e3:16:28)
    Type: IPv4 (0x0800)
Internet Protocol Version 4, Src: 57.132.12.164, Dst: 119.60.94.114
Transmission Control Protocol, Src Port: 23822, Dst Port: 80, Seq: 0, Len: 149
    Source Port: 23822
    Destination Port: 80
    [Stream index: 10]
    [Conversation completeness: Incomplete (9)]
    [TCP Segment Len: 149]
    Sequence Number: 0    (relative sequence number)
    Sequence Number (raw): 0
    [Next Sequence Number: 150    (relative sequence number)]
    Acknowledgment Number: 0
    Acknowledgment number (raw): 0
    0101 .... = Header Length: 20 bytes (5)
    Flags: 0x002 (SYN)
    Window: 8192
    [Calculated window size: 8192]
    Checksum: 0x88ac [unverified]
    [Checksum Status: Unverified]
    Urgent Pointer: 0
    [Timestamps]
    [SEQ/ACK analysis]
    TCP payload (149 bytes)
Hypertext Transfer Protocol
    POST /api/data HTTP/1.1\r\n
    Content-Length: 27\r\n
    Content-Type: application/x-www-form-urlencoded\r\n
    Host: secure930.org\r\n
    \r\n
    [Full request URI: http://secure930.org/api/data]
    [HTTP request 1/1]
    File Data: 23 bytes
HTML Form URL Encoded: application/x-www-form-urlencoded
    Form item: "user" = "MIKE"
        Key: user
        Value: MIKE
[Packet size limited during capture: URL Encoded Form Data truncated]

No.     Time           Source                Destination           Protocol Length Info
    118 8.629520       47.30.67.49           75.212.153.149        HTTP     203    POST /api/data HTTP/1.1  (application/x-www-form-urlencoded)[Packet size limited during capture]

Frame 118: 203 bytes on wire (1624 bits), 194 bytes captured (1552 bits) on interface unknown, id 1
Ethernet II, Src: 5a:4d:fc:4c:f9:56 (5a:4d:fc:4c:f9:56), Dst: a6:e4:19:e6:36:3f (a6:e4:19:e6:36:3f)
    Destination: a6:e4:19:e6:36:3f (a6:e4:19:e6:36:3f)
        Address: a6:e4:19:e6:36:3f (a6:e4:19:e6:36:3f)
        .... ..1. .... .... .... .... = LG bit: Locally administered address (this is NOT the factory default)
        .... ...0 .... .... .... .... = IG bit: Individual address (unicast)
    Source: 5a:4d:fc:4c:f9:56 (5a:4d:fc:4c:f9:56)
        Address: 5a:4d:fc:4c:f9:56 (5a:4d:fc:4c:f9:56)
        .... ..1. .... .... .... .... = LG bit: Locally administered address (this is NOT the factory default)
        .... ...0 .... .... .... .... = IG bit: Individual address (unicast)
    Type: IPv4 (0x0800)
Internet Protocol Version 4, Src: 47.30.67.49, Dst: 75.212.153.149
Transmission Control Protocol, Src Port: 40215, Dst Port: 80, Seq: 0, Len: 149
    Source Port: 40215
    Destination Port: 80
    [Stream index: 13]
    [Conversation completeness: Incomplete (9)]
    [TCP Segment Len: 149]
    Sequence Number: 0    (relative sequence number)
    Sequence Number (raw): 0
    [Next Sequence Number: 150    (relative sequence number)]
    Acknowledgment Number: 0
    Acknowledgment number (raw): 0
    0101 .... = Header Length: 20 bytes (5)
    Flags: 0x002 (SYN)
    Window: 8192
    [Calculated window size: 8192]
    Checksum: 0x0eba [unverified]
    [Checksum Status: Unverified]
    Urgent Pointer: 0
    [Timestamps]
    [SEQ/ACK analysis]
    TCP payload (149 bytes)
Hypertext Transfer Protocol
    POST /api/data HTTP/1.1\r\n
    Content-Length: 27\r\n
    Content-Type: application/x-www-form-urlencoded\r\n
    Host: secure835.org\r\n
    \r\n
    [Full request URI: http://secure835.org/api/data]
    [HTTP request 1/1]
    File Data: 23 bytes
HTML Form URL Encoded: application/x-www-form-urlencoded
    Form item: "user" = "MIKE"
        Key: user
        Value: MIKE
[Packet size limited during capture: URL Encoded Form Data truncated]

No.     Time           Source                Destination           Protocol Length Info
    119 9.021771       171.97.18.6           202.182.232.26        HTTP     125    GET /api/data HTTP/1.1 [Packet size limited during capture]

Frame 119: 125 bytes on wire (1000 bits), 120 bytes captured (960 bits) on interface unknown, id 1
Ethernet II, Src: f9:a0:20:07:3a:e3 (f9:a0:20:07:3a:e3), Dst: a3:50:d6:2a:11:8e (a3:50:d6:2a:11:8e)
    Destination: a3:50:d6:2a:11:8e (a3:50:d6:2a:11:8e)
        Address: a3:50:d6:2a:11:8e (a3:50:d6:2a:11:8e)
        .... ..1. .... .... .... .... = LG bit: Locally administered address (this is NOT the factory default)
        .... ...1 .... .... .... .... = IG bit: Group address (multicast/broadcast)
    Source: f9:a0:20:07:3a:e3 (f9:a0:20:07:3a:e3)
    Type: IPv4 (0x0800)
Internet Protocol Version 4, Src: 171.97.18.6, Dst: 202.182.232.26
Transmission Control Protocol, Src Port: 32176, Dst Port: 80, Seq: 0, Len: 71
    Source Port: 32176
    Destination Port: 80
    [Stream index: 14]
    [Conversation completeness: Incomplete (9)]
    [TCP Segment Len: 71]
    Sequence Number: 0    (relative sequence number)
    Sequence Number (raw): 0
    [Next Sequence Number: 72    (relative sequence number)]
    Acknowledgment Number: 0
    Acknowledgment number (raw): 0
    0101 .... = Header Length: 20 bytes (5)
    Flags: 0x002 (SYN)
    Window: 8192
    [Calculated window size: 8192]
    Checksum: 0xf0db [unverified]
    [Checksum Status: Unverified]
    Urgent Pointer: 0
    [Timestamps]
    [SEQ/ACK analysis]
    TCP payload (71 bytes)
Hypertext Transfer Protocol
    GET /api/data HTTP/1.1\r\n
    Content-Length: 0\r\n
    Host: secure354.org\r\n
    \r\n
    [Full request URI: http://secure354.org/api/data]
    [HTTP request 1/1]
[Packet size limited during capture: HTTP truncated]

No.     Time           Source                Destination           Protocol Length Info
    198 12.944281      8.180.243.160         65.39.127.64          HTTP     113    GET / HTTP/1.1 

Frame 198: 113 bytes on wire (904 bits), 113 bytes captured (904 bits) on interface unknown, id 1
Ethernet II, Src: 93:49:43:8d:2d:be (93:49:43:8d:2d:be), Dst: 8f:35:a2:0b:c8:a6 (8f:35:a2:0b:c8:a6)
    Destination: 8f:35:a2:0b:c8:a6 (8f:35:a2:0b:c8:a6)
        Address: 8f:35:a2:0b:c8:a6 (8f:35:a2:0b:c8:a6)
        .... ..1. .... .... .... .... = LG bit: Locally administered address (this is NOT the factory default)
        .... ...1 .... .... .... .... = IG bit: Group address (multicast/broadcast)
    Source: 93:49:43:8d:2d:be (93:49:43:8d:2d:be)
    Type: IPv4 (0x0800)
Internet Protocol Version 4, Src: 8.180.243.160, Dst: 65.39.127.64
Transmission Control Protocol, Src Port: 13420, Dst Port: 80, Seq: 0, Len: 59
    Source Port: 13420
    Destination Port: 80
    [Stream index: 20]
    [Conversation completeness: Incomplete (9)]
    [TCP Segment Len: 59]
    Sequence Number: 0    (relative sequence number)
    Sequence Number (raw): 0
    [Next Sequence Number: 60    (relative sequence number)]
    Acknowledgment Number: 0
    Acknowledgment number (raw): 0
    0101 .... = Header Length: 20 bytes (5)
    Flags: 0x002 (SYN)
    Window: 8192
    [Calculated window size: 8192]
    Checksum: 0xd2d6 [unverified]
    [Checksum Status: Unverified]
    Urgent Pointer: 0
    [Timestamps]
    [SEQ/ACK analysis]
    TCP payload (59 bytes)
Hypertext Transfer Protocol
    GET / HTTP/1.1\r\n
    Content-Length: 0\r\n
    Host: www.google.com\r\n
    \r\n
    [Full request URI: http://www.google.com/]
    [HTTP request 1/1]
    [Response in frame: 199]

No.     Time           Source                Destination           Protocol Length Info
    199 13.018347      65.39.127.64          8.180.243.160         HTTP     178    HTTP/1.1 200 OK 

Frame 199: 178 bytes on wire (1424 bits), 178 bytes captured (1424 bits) on interface unknown, id 1
Ethernet II, Src: 9d:f1:86:ca:61:a5 (9d:f1:86:ca:61:a5), Dst: 71:87:91:b9:f4:c1 (71:87:91:b9:f4:c1)
    Destination: 71:87:91:b9:f4:c1 (71:87:91:b9:f4:c1)
        Address: 71:87:91:b9:f4:c1 (71:87:91:b9:f4:c1)
        .... ..0. .... .... .... .... = LG bit: Globally unique address (factory default)
        .... ...1 .... .... .... .... = IG bit: Group address (multicast/broadcast)
    Source: 9d:f1:86:ca:61:a5 (9d:f1:86:ca:61:a5)
    Type: IPv4 (0x0800)
Internet Protocol Version 4, Src: 65.39.127.64, Dst: 8.180.243.160
Transmission Control Protocol, Src Port: 80, Dst Port: 13420, Seq: 0, Len: 124
    Source Port: 80
    Destination Port: 13420
    [Stream index: 20]
    [Conversation completeness: Incomplete (9)]
    [TCP Segment Len: 124]
    Sequence Number: 0    (relative sequence number)
    Sequence Number (raw): 0
    [Next Sequence Number: 125    (relative sequence number)]
    Acknowledgment Number: 0
    Acknowledgment number (raw): 0
    0101 .... = Header Length: 20 bytes (5)
    Flags: 0x002 (SYN)
    Window: 8192
    [Calculated window size: 8192]
    Checksum: 0x18e2 [unverified]
    [Checksum Status: Unverified]
    Urgent Pointer: 0
    [Timestamps]
    [SEQ/ACK analysis]
    TCP payload (124 bytes)
Hypertext Transfer Protocol
    HTTP/1.1 200 OK\r\n
    Content-Length: 48\r\n
    Date: Sat, 19 Oct 2024 10:24:52 GMT\r\n
    \r\n
    [HTTP response 1/1]
    [Time since request: 0.074066000 seconds]
    [Request in frame: 198]
    [Request URI: http://www.google.com/]
    File Data: 48 bytes
    Data (48 bytes)

0000  3c 68 74 6d 6c 3e 3c 62 6f 64 79 3e 3c 68 31 3e   <html><body><h1>
0010  48 65 6c 6c 6f 2c 20 57 6f 72 6c 64 21 3c 2f 68   Hello, World!</h
0020  31 3e 3c 2f 62 6f 64 79 3e 3c 2f 68 74 6d 6c 3e   1></body></html>

No.     Time           Source                Destination           Protocol Length Info
    223 14.513284      64.47.24.133          78.142.247.146        HTTP     113    GET / HTTP/1.1 

Frame 223: 113 bytes on wire (904 bits), 113 bytes captured (904 bits) on interface unknown, id 1
Ethernet II, Src: e4:76:9c:85:d6:16 (e4:76:9c:85:d6:16), Dst: 13:38:d8:ee:aa:25 (13:38:d8:ee:aa:25)
    Destination: 13:38:d8:ee:aa:25 (13:38:d8:ee:aa:25)
        Address: 13:38:d8:ee:aa:25 (13:38:d8:ee:aa:25)
        .... ..1. .... .... .... .... = LG bit: Locally administered address (this is NOT the factory default)
        .... ...1 .... .... .... .... = IG bit: Group address (multicast/broadcast)
    Source: e4:76:9c:85:d6:16 (e4:76:9c:85:d6:16)
        Address: e4:76:9c:85:d6:16 (e4:76:9c:85:d6:16)
        .... ..0. .... .... .... .... = LG bit: Globally unique address (factory default)
        .... ...0 .... .... .... .... = IG bit: Individual address (unicast)
    Type: IPv4 (0x0800)
Internet Protocol Version 4, Src: 64.47.24.133, Dst: 78.142.247.146
Transmission Control Protocol, Src Port: 52217, Dst Port: 80, Seq: 0, Len: 59
    Source Port: 52217
    Destination Port: 80
    [Stream index: 24]
    [Conversation completeness: Incomplete (9)]
    [TCP Segment Len: 59]
    Sequence Number: 0    (relative sequence number)
    Sequence Number (raw): 0
    [Next Sequence Number: 60    (relative sequence number)]
    Acknowledgment Number: 0
    Acknowledgment number (raw): 0
    0101 .... = Header Length: 20 bytes (5)
    Flags: 0x002 (SYN)
    Window: 8192
    [Calculated window size: 8192]
    Checksum: 0x5930 [unverified]
    [Checksum Status: Unverified]
    Urgent Pointer: 0
    [Timestamps]
    [SEQ/ACK analysis]
    TCP payload (59 bytes)
Hypertext Transfer Protocol
    GET / HTTP/1.1\r\n
    Content-Length: 0\r\n
    Host: www.google.com\r\n
    \r\n
    [Full request URI: http://www.google.com/]
    [HTTP request 1/1]
    [Response in frame: 224]

No.     Time           Source                Destination           Protocol Length Info
    224 14.523196      78.142.247.146        64.47.24.133          HTTP     178    HTTP/1.1 200 OK 

Frame 224: 178 bytes on wire (1424 bits), 178 bytes captured (1424 bits) on interface unknown, id 1
Ethernet II, Src: 72:24:85:df:a0:16 (72:24:85:df:a0:16), Dst: 3c:ba:3e:d3:f7:f0 (3c:ba:3e:d3:f7:f0)
    Destination: 3c:ba:3e:d3:f7:f0 (3c:ba:3e:d3:f7:f0)
        Address: 3c:ba:3e:d3:f7:f0 (3c:ba:3e:d3:f7:f0)
        .... ..0. .... .... .... .... = LG bit: Globally unique address (factory default)
        .... ...0 .... .... .... .... = IG bit: Individual address (unicast)
    Source: 72:24:85:df:a0:16 (72:24:85:df:a0:16)
        Address: 72:24:85:df:a0:16 (72:24:85:df:a0:16)
        .... ..1. .... .... .... .... = LG bit: Locally administered address (this is NOT the factory default)
        .... ...0 .... .... .... .... = IG bit: Individual address (unicast)
    Type: IPv4 (0x0800)
Internet Protocol Version 4, Src: 78.142.247.146, Dst: 64.47.24.133
Transmission Control Protocol, Src Port: 80, Dst Port: 52217, Seq: 0, Len: 124
    Source Port: 80
    Destination Port: 52217
    [Stream index: 24]
    [Conversation completeness: Incomplete (9)]
    [TCP Segment Len: 124]
    Sequence Number: 0    (relative sequence number)
    Sequence Number (raw): 0
    [Next Sequence Number: 125    (relative sequence number)]
    Acknowledgment Number: 0
    Acknowledgment number (raw): 0
    0101 .... = Header Length: 20 bytes (5)
    Flags: 0x002 (SYN)
    Window: 8192
    [Calculated window size: 8192]
    Checksum: 0x9f3b [unverified]
    [Checksum Status: Unverified]
    Urgent Pointer: 0
    [Timestamps]
    [SEQ/ACK analysis]
    TCP payload (124 bytes)
Hypertext Transfer Protocol
    HTTP/1.1 200 OK\r\n
    Content-Length: 48\r\n
    Date: Sat, 19 Oct 2024 10:24:52 GMT\r\n
    \r\n
    [HTTP response 1/1]
    [Time since request: 0.009912000 seconds]
    [Request in frame: 223]
    [Request URI: http://www.google.com/]
    File Data: 48 bytes
    Data (48 bytes)

0000  3c 68 74 6d 6c 3e 3c 62 6f 64 79 3e 3c 68 31 3e   <html><body><h1>
0010  48 65 6c 6c 6f 2c 20 57 6f 72 6c 64 21 3c 2f 68   Hello, World!</h
0020  31 3e 3c 2f 62 6f 64 79 3e 3c 2f 68 74 6d 6c 3e   1></body></html>

No.     Time           Source                Destination           Protocol Length Info
    226 15.297786      154.168.158.134       181.93.49.214         HTTP     113    GET / HTTP/1.1 

Frame 226: 113 bytes on wire (904 bits), 113 bytes captured (904 bits) on interface unknown, id 1
Ethernet II, Src: 46:4b:d1:28:ba:cb (46:4b:d1:28:ba:cb), Dst: 5f:29:55:a1:bf:26 (5f:29:55:a1:bf:26)
    Destination: 5f:29:55:a1:bf:26 (5f:29:55:a1:bf:26)
        Address: 5f:29:55:a1:bf:26 (5f:29:55:a1:bf:26)
        .... ..1. .... .... .... .... = LG bit: Locally administered address (this is NOT the factory default)
        .... ...1 .... .... .... .... = IG bit: Group address (multicast/broadcast)
    Source: 46:4b:d1:28:ba:cb (46:4b:d1:28:ba:cb)
        Address: 46:4b:d1:28:ba:cb (46:4b:d1:28:ba:cb)
        .... ..1. .... .... .... .... = LG bit: Locally administered address (this is NOT the factory default)
        .... ...0 .... .... .... .... = IG bit: Individual address (unicast)
    Type: IPv4 (0x0800)
Internet Protocol Version 4, Src: 154.168.158.134, Dst: 181.93.49.214
Transmission Control Protocol, Src Port: 64983, Dst Port: 80, Seq: 0, Len: 59
    Source Port: 64983
    Destination Port: 80
    [Stream index: 26]
    [Conversation completeness: Incomplete (9)]
    [TCP Segment Len: 59]
    Sequence Number: 0    (relative sequence number)
    Sequence Number (raw): 0
    [Next Sequence Number: 60    (relative sequence number)]
    Acknowledgment Number: 0
    Acknowledgment number (raw): 0
    0101 .... = Header Length: 20 bytes (5)
    Flags: 0x002 (SYN)
    Window: 8192
    [Calculated window size: 8192]
    Checksum: 0xa5c4 [unverified]
    [Checksum Status: Unverified]
    Urgent Pointer: 0
    [Timestamps]
    [SEQ/ACK analysis]
    TCP payload (59 bytes)
Hypertext Transfer Protocol
    GET / HTTP/1.1\r\n
    Content-Length: 0\r\n
    Host: www.google.com\r\n
    \r\n
    [Full request URI: http://www.google.com/]
    [HTTP request 1/1]
    [Response in frame: 227]

No.     Time           Source                Destination           Protocol Length Info
    227 15.325099      181.93.49.214         154.168.158.134       HTTP     178    HTTP/1.1 200 OK 

Frame 227: 178 bytes on wire (1424 bits), 178 bytes captured (1424 bits) on interface unknown, id 1
Ethernet II, Src: d5:35:69:df:57:34 (d5:35:69:df:57:34), Dst: 15:06:c3:51:a0:a7 (15:06:c3:51:a0:a7)
    Destination: 15:06:c3:51:a0:a7 (15:06:c3:51:a0:a7)
        Address: 15:06:c3:51:a0:a7 (15:06:c3:51:a0:a7)
        .... ..0. .... .... .... .... = LG bit: Globally unique address (factory default)
        .... ...1 .... .... .... .... = IG bit: Group address (multicast/broadcast)
    Source: d5:35:69:df:57:34 (d5:35:69:df:57:34)
    Type: IPv4 (0x0800)
Internet Protocol Version 4, Src: 181.93.49.214, Dst: 154.168.158.134
Transmission Control Protocol, Src Port: 80, Dst Port: 64983, Seq: 0, Len: 124
    Source Port: 80
    Destination Port: 64983
    [Stream index: 26]
    [Conversation completeness: Incomplete (9)]
    [TCP Segment Len: 124]
    Sequence Number: 0    (relative sequence number)
    Sequence Number (raw): 0
    [Next Sequence Number: 125    (relative sequence number)]
    Acknowledgment Number: 0
    Acknowledgment number (raw): 0
    0101 .... = Header Length: 20 bytes (5)
    Flags: 0x002 (SYN)
    Window: 8192
    [Calculated window size: 8192]
    Checksum: 0xebcf [unverified]
    [Checksum Status: Unverified]
    Urgent Pointer: 0
    [Timestamps]
    [SEQ/ACK analysis]
    TCP payload (124 bytes)
Hypertext Transfer Protocol
    HTTP/1.1 200 OK\r\n
    Content-Length: 48\r\n
    Date: Sat, 19 Oct 2024 10:24:52 GMT\r\n
    \r\n
    [HTTP response 1/1]
    [Time since request: 0.027313000 seconds]
    [Request in frame: 226]
    [Request URI: http://www.google.com/]
    File Data: 48 bytes
    Data (48 bytes)

0000  3c 68 74 6d 6c 3e 3c 62 6f 64 79 3e 3c 68 31 3e   <html><body><h1>
0010  48 65 6c 6c 6f 2c 20 57 6f 72 6c 64 21 3c 2f 68   Hello, World!</h
0020  31 3e 3c 2f 62 6f 64 79 3e 3c 2f 68 74 6d 6c 3e   1></body></html>

No.     Time           Source                Destination           Protocol Length Info
    228 15.690037      46.253.218.72         82.62.58.129          HTTP     113    GET / HTTP/1.1 

Frame 228: 113 bytes on wire (904 bits), 113 bytes captured (904 bits) on interface unknown, id 1
Ethernet II, Src: 11:4c:f7:e4:f2:b3 (11:4c:f7:e4:f2:b3), Dst: f1:cb:07:17:2e:f6 (f1:cb:07:17:2e:f6)
    Destination: f1:cb:07:17:2e:f6 (f1:cb:07:17:2e:f6)
        Address: f1:cb:07:17:2e:f6 (f1:cb:07:17:2e:f6)
        .... ..0. .... .... .... .... = LG bit: Globally unique address (factory default)
        .... ...1 .... .... .... .... = IG bit: Group address (multicast/broadcast)
    Source: 11:4c:f7:e4:f2:b3 (11:4c:f7:e4:f2:b3)
    Type: IPv4 (0x0800)
Internet Protocol Version 4, Src: 46.253.218.72, Dst: 82.62.58.129
Transmission Control Protocol, Src Port: 12804, Dst Port: 80, Seq: 0, Len: 59
    Source Port: 12804
    Destination Port: 80
    [Stream index: 27]
    [Conversation completeness: Incomplete (9)]
    [TCP Segment Len: 59]
    Sequence Number: 0    (relative sequence number)
    Sequence Number (raw): 0
    [Next Sequence Number: 60    (relative sequence number)]
    Acknowledgment Number: 0
    Acknowledgment number (raw): 0
    0101 .... = Header Length: 20 bytes (5)
    Flags: 0x002 (SYN)
    Window: 8192
    [Calculated window size: 8192]
    Checksum: 0xfbf5 [unverified]
    [Checksum Status: Unverified]
    Urgent Pointer: 0
    [Timestamps]
    [SEQ/ACK analysis]
    TCP payload (59 bytes)
Hypertext Transfer Protocol
    GET / HTTP/1.1\r\n
    Content-Length: 0\r\n
    Host: www.google.com\r\n
    \r\n
    [Full request URI: http://www.google.com/]
    [HTTP request 1/1]
    [Response in frame: 229]

No.     Time           Source                Destination           Protocol Length Info
    229 15.734789      82.62.58.129          46.253.218.72         HTTP     178    HTTP/1.1 200 OK 

Frame 229: 178 bytes on wire (1424 bits), 178 bytes captured (1424 bits) on interface unknown, id 1
Ethernet II, Src: 06:6c:47:f1:ee:1d (06:6c:47:f1:ee:1d), Dst: 0a:ee:f5:4a:90:c7 (0a:ee:f5:4a:90:c7)
    Destination: 0a:ee:f5:4a:90:c7 (0a:ee:f5:4a:90:c7)
        Address: 0a:ee:f5:4a:90:c7 (0a:ee:f5:4a:90:c7)
        .... ..1. .... .... .... .... = LG bit: Locally administered address (this is NOT the factory default)
        .... ...0 .... .... .... .... = IG bit: Individual address (unicast)
    Source: 06:6c:47:f1:ee:1d (06:6c:47:f1:ee:1d)
        Address: 06:6c:47:f1:ee:1d (06:6c:47:f1:ee:1d)
        .... ..1. .... .... .... .... = LG bit: Locally administered address (this is NOT the factory default)
        .... ...0 .... .... .... .... = IG bit: Individual address (unicast)
    Type: IPv4 (0x0800)
Internet Protocol Version 4, Src: 82.62.58.129, Dst: 46.253.218.72
Transmission Control Protocol, Src Port: 80, Dst Port: 12804, Seq: 0, Len: 124
    Source Port: 80
    Destination Port: 12804
    [Stream index: 27]
    [Conversation completeness: Incomplete (9)]
    [TCP Segment Len: 124]
    Sequence Number: 0    (relative sequence number)
    Sequence Number (raw): 0
    [Next Sequence Number: 125    (relative sequence number)]
    Acknowledgment Number: 0
    Acknowledgment number (raw): 0
    0101 .... = Header Length: 20 bytes (5)
    Flags: 0x002 (SYN)
    Window: 8192
    [Calculated window size: 8192]
    Checksum: 0x4201 [unverified]
    [Checksum Status: Unverified]
    Urgent Pointer: 0
    [Timestamps]
    [SEQ/ACK analysis]
    TCP payload (124 bytes)
Hypertext Transfer Protocol
    HTTP/1.1 200 OK\r\n
    Content-Length: 48\r\n
    Date: Sat, 19 Oct 2024 10:24:52 GMT\r\n
    \r\n
    [HTTP response 1/1]
    [Time since request: 0.044752000 seconds]
    [Request in frame: 228]
    [Request URI: http://www.google.com/]
    File Data: 48 bytes
    Data (48 bytes)

0000  3c 68 74 6d 6c 3e 3c 62 6f 64 79 3e 3c 68 31 3e   <html><body><h1>
0010  48 65 6c 6c 6f 2c 20 57 6f 72 6c 64 21 3c 2f 68   Hello, World!</h
0020  31 3e 3c 2f 62 6f 64 79 3e 3c 2f 68 74 6d 6c 3e   1></body></html>

No.     Time           Source                Destination           Protocol Length Info
    230 16.082288      254.20.55.176         235.112.120.253       HTTP     113    GET / HTTP/1.1 

Frame 230: 113 bytes on wire (904 bits), 113 bytes captured (904 bits) on interface unknown, id 1
Ethernet II, Src: 8e:6c:8a:1f:29:cf (8e:6c:8a:1f:29:cf), Dst: de:c9:36:ad:2a:f0 (de:c9:36:ad:2a:f0)
    Destination: de:c9:36:ad:2a:f0 (de:c9:36:ad:2a:f0)
        Address: de:c9:36:ad:2a:f0 (de:c9:36:ad:2a:f0)
        .... ..1. .... .... .... .... = LG bit: Locally administered address (this is NOT the factory default)
        .... ...0 .... .... .... .... = IG bit: Individual address (unicast)
    Source: 8e:6c:8a:1f:29:cf (8e:6c:8a:1f:29:cf)
        Address: 8e:6c:8a:1f:29:cf (8e:6c:8a:1f:29:cf)
        .... ..1. .... .... .... .... = LG bit: Locally administered address (this is NOT the factory default)
        .... ...0 .... .... .... .... = IG bit: Individual address (unicast)
    Type: IPv4 (0x0800)
Internet Protocol Version 4, Src: 254.20.55.176, Dst: 235.112.120.253
Transmission Control Protocol, Src Port: 63276, Dst Port: 80, Seq: 0, Len: 59
    Source Port: 63276
    Destination Port: 80
    [Stream index: 28]
    [Conversation completeness: Incomplete (9)]
    [TCP Segment Len: 59]
    Sequence Number: 0    (relative sequence number)
    Sequence Number (raw): 0
    [Next Sequence Number: 60    (relative sequence number)]
    Acknowledgment Number: 0
    Acknowledgment number (raw): 0
    0101 .... = Header Length: 20 bytes (5)
    Flags: 0x002 (SYN)
    Window: 8192
    [Calculated window size: 8192]
    Checksum: 0x329f [unverified]
    [Checksum Status: Unverified]
    Urgent Pointer: 0
    [Timestamps]
    [SEQ/ACK analysis]
    TCP payload (59 bytes)
Hypertext Transfer Protocol
    GET / HTTP/1.1\r\n
    Content-Length: 0\r\n
    Host: www.google.com\r\n
    \r\n
    [Full request URI: http://www.google.com/]
    [HTTP request 1/1]
    [Response in frame: 231]

No.     Time           Source                Destination           Protocol Length Info
    231 16.086942      235.112.120.253       254.20.55.176         HTTP     178    HTTP/1.1 200 OK 

Frame 231: 178 bytes on wire (1424 bits), 178 bytes captured (1424 bits) on interface unknown, id 1
Ethernet II, Src: fd:0e:fb:ea:58:67 (fd:0e:fb:ea:58:67), Dst: 49:6a:47:6c:8b:a1 (49:6a:47:6c:8b:a1)
    Destination: 49:6a:47:6c:8b:a1 (49:6a:47:6c:8b:a1)
        Address: 49:6a:47:6c:8b:a1 (49:6a:47:6c:8b:a1)
        .... ..0. .... .... .... .... = LG bit: Globally unique address (factory default)
        .... ...1 .... .... .... .... = IG bit: Group address (multicast/broadcast)
    Source: fd:0e:fb:ea:58:67 (fd:0e:fb:ea:58:67)
    Type: IPv4 (0x0800)
Internet Protocol Version 4, Src: 235.112.120.253, Dst: 254.20.55.176
Transmission Control Protocol, Src Port: 80, Dst Port: 63276, Seq: 0, Len: 124
    Source Port: 80
    Destination Port: 63276
    [Stream index: 28]
    [Conversation completeness: Incomplete (9)]
    [TCP Segment Len: 124]
    Sequence Number: 0    (relative sequence number)
    Sequence Number (raw): 0
    [Next Sequence Number: 125    (relative sequence number)]
    Acknowledgment Number: 0
    Acknowledgment number (raw): 0
    0101 .... = Header Length: 20 bytes (5)
    Flags: 0x002 (SYN)
    Window: 8192
    [Calculated window size: 8192]
    Checksum: 0x78aa [unverified]
    [Checksum Status: Unverified]
    Urgent Pointer: 0
    [Timestamps]
    [SEQ/ACK analysis]
    TCP payload (124 bytes)
Hypertext Transfer Protocol
    HTTP/1.1 200 OK\r\n
    Content-Length: 48\r\n
    Date: Sat, 19 Oct 2024 10:24:52 GMT\r\n
    \r\n
    [HTTP response 1/1]
    [Time since request: 0.004654000 seconds]
    [Request in frame: 230]
    [Request URI: http://www.google.com/]
    File Data: 48 bytes
    Data (48 bytes)

0000  3c 68 74 6d 6c 3e 3c 62 6f 64 79 3e 3c 68 31 3e   <html><body><h1>
0010  48 65 6c 6c 6f 2c 20 57 6f 72 6c 64 21 3c 2f 68   Hello, World!</h
0020  31 3e 3c 2f 62 6f 64 79 3e 3c 2f 68 74 6d 6c 3e   1></body></html>

No.     Time           Source                Destination           Protocol Length Info
    245 18.043543      53.44.44.195          59.99.116.138         HTTP     205    POST /index.html HTTP/1.1  (application/x-www-form-urlencoded)[Packet size limited during capture]

Frame 245: 205 bytes on wire (1640 bits), 196 bytes captured (1568 bits) on interface unknown, id 1
Ethernet II, Src: 0e:90:f3:3b:a8:07 (0e:90:f3:3b:a8:07), Dst: 87:40:98:26:da:1e (87:40:98:26:da:1e)
    Destination: 87:40:98:26:da:1e (87:40:98:26:da:1e)
        Address: 87:40:98:26:da:1e (87:40:98:26:da:1e)
        .... ..1. .... .... .... .... = LG bit: Locally administered address (this is NOT the factory default)
        .... ...1 .... .... .... .... = IG bit: Group address (multicast/broadcast)
    Source: 0e:90:f3:3b:a8:07 (0e:90:f3:3b:a8:07)
        Address: 0e:90:f3:3b:a8:07 (0e:90:f3:3b:a8:07)
        .... ..1. .... .... .... .... = LG bit: Locally administered address (this is NOT the factory default)
        .... ...0 .... .... .... .... = IG bit: Individual address (unicast)
    Type: IPv4 (0x0800)
Internet Protocol Version 4, Src: 53.44.44.195, Dst: 59.99.116.138
Transmission Control Protocol, Src Port: 13899, Dst Port: 80, Seq: 0, Len: 151
    Source Port: 13899
    Destination Port: 80
    [Stream index: 32]
    [Conversation completeness: Incomplete (9)]
    [TCP Segment Len: 151]
    Sequence Number: 0    (relative sequence number)
    Sequence Number (raw): 0
    [Next Sequence Number: 152    (relative sequence number)]
    Acknowledgment Number: 0
    Acknowledgment number (raw): 0
    0101 .... = Header Length: 20 bytes (5)
    Flags: 0x002 (SYN)
    Window: 8192
    [Calculated window size: 8192]
    Checksum: 0x41e1 [unverified]
    [Checksum Status: Unverified]
    Urgent Pointer: 0
    [Timestamps]
    [SEQ/ACK analysis]
    TCP payload (151 bytes)
Hypertext Transfer Protocol
    POST /index.html HTTP/1.1\r\n
    Content-Length: 27\r\n
    Content-Type: application/x-www-form-urlencoded\r\n
    Host: secure620.org\r\n
    \r\n
    [Full request URI: http://secure620.org/index.html]
    [HTTP request 1/1]
    File Data: 23 bytes
HTML Form URL Encoded: application/x-www-form-urlencoded
    Form item: "user" = "MIKE"
        Key: user
        Value: MIKE
[Packet size limited during capture: URL Encoded Form Data truncated]

No.     Time           Source                Destination           Protocol Length Info
    275 22.750554      242.207.58.190        217.25.102.12         HTTP     113    GET / HTTP/1.1 

Frame 275: 113 bytes on wire (904 bits), 113 bytes captured (904 bits) on interface unknown, id 1
Ethernet II, Src: de:7b:cd:fa:d8:83 (de:7b:cd:fa:d8:83), Dst: d2:b1:fb:25:c5:a7 (d2:b1:fb:25:c5:a7)
    Destination: d2:b1:fb:25:c5:a7 (d2:b1:fb:25:c5:a7)
        Address: d2:b1:fb:25:c5:a7 (d2:b1:fb:25:c5:a7)
        .... ..1. .... .... .... .... = LG bit: Locally administered address (this is NOT the factory default)
        .... ...0 .... .... .... .... = IG bit: Individual address (unicast)
    Source: de:7b:cd:fa:d8:83 (de:7b:cd:fa:d8:83)
        Address: de:7b:cd:fa:d8:83 (de:7b:cd:fa:d8:83)
