No.     Time           Source                Destination           Protocol Length Info
      1 0.000000       60.38.44.143          172.232.161.40        TCP      54     28168 → 49914 [SYN] Seq=0 Win=8192 Len=0

Frame 1: 54 bytes on wire (432 bits), 54 bytes captured (432 bits) on interface unknown, id 1
Ethernet II, Src: 5f:a0:e6:94:bf:9e (5f:a0:e6:94:bf:9e), Dst: f7:50:40:54:52:eb (f7:50:40:54:52:eb)
    Destination: f7:50:40:54:52:eb (f7:50:40:54:52:eb)
        Address: f7:50:40:54:52:eb (f7:50:40:54:52:eb)
        .... ..1. .... .... .... .... = LG bit: Locally administered address (this is NOT the factory default)
        .... ...1 .... .... .... .... = IG bit: Group address (multicast/broadcast)
    Source: 5f:a0:e6:94:bf:9e (5f:a0:e6:94:bf:9e)
    Type: IPv4 (0x0800)
Internet Protocol Version 4, Src: 60.38.44.143, Dst: 172.232.161.40
Transmission Control Protocol, Src Port: 28168, Dst Port: 49914, Seq: 0, Len: 0
    Source Port: 28168
    Destination Port: 49914
    [Stream index: 0]
    [Conversation completeness: Complete, WITH_DATA (31)]
    [TCP Segment Len: 0]
    Sequence Number: 0    (relative sequence number)
    Sequence Number (raw): 0
    [Next Sequence Number: 1    (relative sequence number)]
    Acknowledgment Number: 0
    Acknowledgment number (raw): 0
    0101 .... = Header Length: 20 bytes (5)
    Flags: 0x002 (SYN)
    Window: 8192
    [Calculated window size: 8192]
    Checksum: 0xa819 [unverified]
    [Checksum Status: Unverified]
    Urgent Pointer: 0
    [Timestamps]

No.     Time           Source                Destination           Protocol Length Info
      2 0.000000       host                  3.1.0                 USB      64     GET DESCRIPTOR Request DEVICE

Frame 2: 64 bytes on wire (512 bits), 64 bytes captured (512 bits) on interface usbmon3, id 0
USB URB
Setup Data

No.     Time           Source                Destination           Protocol Length Info
      3 0.000013       3.1.0                 host                  USB      82     GET DESCRIPTOR Response DEVICE

Frame 3: 82 bytes on wire (656 bits), 82 bytes captured (656 bits) on interface usbmon3, id 0
USB URB
DEVICE DESCRIPTOR

No.     Time           Source                Destination           Protocol Length Info
      4 0.000039       host                  3.1.0                 USB      64     GET DESCRIPTOR Request CONFIGURATION

Frame 4: 64 bytes on wire (512 bits), 64 bytes captured (512 bits) on interface usbmon3, id 0
USB URB
Setup Data

No.     Time           Source                Destination           Protocol Length Info
      5 0.000041       3.1.0                 host                  USB      73     GET DESCRIPTOR Response CONFIGURATION

Frame 5: 73 bytes on wire (584 bits), 73 bytes captured (584 bits) on interface usbmon3, id 0
USB URB
CONFIGURATION DESCRIPTOR

No.     Time           Source                Destination           Protocol Length Info
      6 0.000103       host                  3.1.0                 USB      64     GET DESCRIPTOR Request CONFIGURATION

Frame 6: 64 bytes on wire (512 bits), 64 bytes captured (512 bits) on interface usbmon3, id 0
USB URB
Setup Data

No.     Time           Source                Destination           Protocol Length Info
      7 0.000109       3.1.0                 host                  USB      89     GET DESCRIPTOR Response CONFIGURATION

Frame 7: 89 bytes on wire (712 bits), 89 bytes captured (712 bits) on interface usbmon3, id 0
USB URB
CONFIGURATION DESCRIPTOR
INTERFACE DESCRIPTOR (0.0): class Hub
ENDPOINT DESCRIPTOR

No.     Time           Source                Destination           Protocol Length Info
      8 0.000144       host                  3.3.0                 USB      64     GET DESCRIPTOR Request DEVICE

Frame 8: 64 bytes on wire (512 bits), 64 bytes captured (512 bits) on interface usbmon3, id 0
USB URB
Setup Data

No.     Time           Source                Destination           Protocol Length Info
      9 0.002311       3.3.0                 host                  USB      82     GET DESCRIPTOR Response DEVICE

Frame 9: 82 bytes on wire (656 bits), 82 bytes captured (656 bits) on interface usbmon3, id 0
USB URB
DEVICE DESCRIPTOR

No.     Time           Source                Destination           Protocol Length Info
     10 0.002331       host                  3.3.0                 USB      64     GET DESCRIPTOR Request CONFIGURATION

Frame 10: 64 bytes on wire (512 bits), 64 bytes captured (512 bits) on interface usbmon3, id 0
USB URB
Setup Data

No.     Time           Source                Destination           Protocol Length Info
     11 0.003976       3.3.0                 host                  USB      73     GET DESCRIPTOR Response CONFIGURATION

Frame 11: 73 bytes on wire (584 bits), 73 bytes captured (584 bits) on interface usbmon3, id 0
USB URB
CONFIGURATION DESCRIPTOR

No.     Time           Source                Destination           Protocol Length Info
     12 0.004014       host                  3.3.0                 USB      64     GET DESCRIPTOR Request CONFIGURATION

Frame 12: 64 bytes on wire (512 bits), 64 bytes captured (512 bits) on interface usbmon3, id 0
USB URB
Setup Data

No.     Time           Source                Destination           Protocol Length Info
     13 0.013393       172.232.161.40        60.38.44.143          TCP      54     49914 → 28168 [SYN, ACK] Seq=0 Ack=0 Win=8192 Len=0

Frame 13: 54 bytes on wire (432 bits), 54 bytes captured (432 bits) on interface unknown, id 1
Ethernet II, Src: 1e:1b:bd:14:37:59 (1e:1b:bd:14:37:59), Dst: 8a:e6:fa:4e:bf:a6 (8a:e6:fa:4e:bf:a6)
    Destination: 8a:e6:fa:4e:bf:a6 (8a:e6:fa:4e:bf:a6)
        Address: 8a:e6:fa:4e:bf:a6 (8a:e6:fa:4e:bf:a6)
        .... ..1. .... .... .... .... = LG bit: Locally administered address (this is NOT the factory default)
        .... ...0 .... .... .... .... = IG bit: Individual address (unicast)
    Source: 1e:1b:bd:14:37:59 (1e:1b:bd:14:37:59)
        Address: 1e:1b:bd:14:37:59 (1e:1b:bd:14:37:59)
        .... ..1. .... .... .... .... = LG bit: Locally administered address (this is NOT the factory default)
        .... ...0 .... .... .... .... = IG bit: Individual address (unicast)
    Type: IPv4 (0x0800)
Internet Protocol Version 4, Src: 172.232.161.40, Dst: 60.38.44.143
Transmission Control Protocol, Src Port: 49914, Dst Port: 28168, Seq: 0, Ack: 0, Len: 0
    Source Port: 49914
    Destination Port: 28168
    [Stream index: 0]
    [Conversation completeness: Complete, WITH_DATA (31)]
    [TCP Segment Len: 0]
    Sequence Number: 0    (relative sequence number)
    Sequence Number (raw): 0
    [Next Sequence Number: 1    (relative sequence number)]
    Acknowledgment Number: 0    (relative ack number)
    Acknowledgment number (raw): 0
    0101 .... = Header Length: 20 bytes (5)
    Flags: 0x012 (SYN, ACK)
    Window: 8192
    [Calculated window size: 8192]
    Checksum: 0xa809 [unverified]
    [Checksum Status: Unverified]
    Urgent Pointer: 0
    [Timestamps]

No.     Time           Source                Destination           Protocol Length Info
     14 0.018240       3.3.0                 host                  USB      661    GET DESCRIPTOR Response CONFIGURATION

Frame 14: 661 bytes on wire (5288 bits), 661 bytes captured (5288 bits) on interface usbmon3, id 0
USB URB
CONFIGURATION DESCRIPTOR
INTERFACE ASSOCIATION DESCRIPTOR
INTERFACE DESCRIPTOR (0.0): class Video
VIDEO CONTROL INTERFACE DESCRIPTOR [Header]
VIDEO CONTROL INTERFACE DESCRIPTOR [Input Terminal] (Entity 1)
VIDEO CONTROL INTERFACE DESCRIPTOR [Processing Unit] (Entity 2)
VIDEO CONTROL INTERFACE DESCRIPTOR [Extension Unit] (Entity 3)
VIDEO CONTROL INTERFACE DESCRIPTOR [Extension Unit] (Entity 4)
VIDEO CONTROL INTERFACE DESCRIPTOR [Output Terminal] (Entity 5)
ENDPOINT DESCRIPTOR
VIDEO CONTROL ENDPOINT DESCRIPTOR [Interrupt]
INTERFACE DESCRIPTOR (1.0): class Video
VIDEO STREAMING INTERFACE DESCRIPTOR [Input Header]
VIDEO STREAMING INTERFACE DESCRIPTOR [Format MJPEG]  (Format 1)
VIDEO STREAMING INTERFACE DESCRIPTOR [Frame MJPEG]   (Index  1): 1280 x  720
VIDEO STREAMING INTERFACE DESCRIPTOR [Frame MJPEG]   (Index  2):  640 x  480
VIDEO STREAMING INTERFACE DESCRIPTOR [Frame MJPEG]   (Index  3):  640 x  360
VIDEO STREAMING INTERFACE DESCRIPTOR [Colorformat]
VIDEO STREAMING INTERFACE DESCRIPTOR [Format Uncompressed]  (Format 2): YUY2
VIDEO STREAMING INTERFACE DESCRIPTOR [Frame Uncompressed]   (Index  1): 1280 x  720
VIDEO STREAMING INTERFACE DESCRIPTOR [Frame Uncompressed]   (Index  2):  640 x  480
VIDEO STREAMING INTERFACE DESCRIPTOR [Frame Uncompressed]   (Index  3):  640 x  360
VIDEO STREAMING INTERFACE DESCRIPTOR [Colorformat]
INTERFACE DESCRIPTOR (1.1): class Video
ENDPOINT DESCRIPTOR
INTERFACE DESCRIPTOR (1.2): class Video
ENDPOINT DESCRIPTOR
INTERFACE DESCRIPTOR (1.3): class Video
ENDPOINT DESCRIPTOR
INTERFACE DESCRIPTOR (1.4): class Video
ENDPOINT DESCRIPTOR
INTERFACE DESCRIPTOR (1.5): class Video
ENDPOINT DESCRIPTOR
INTERFACE DESCRIPTOR (1.6): class Video
ENDPOINT DESCRIPTOR
INTERFACE DESCRIPTOR (1.7): class Video
ENDPOINT DESCRIPTOR
INTERFACE DESCRIPTOR (1.8): class Video
ENDPOINT DESCRIPTOR
INTERFACE DESCRIPTOR (1.9): class Video
ENDPOINT DESCRIPTOR
INTERFACE DESCRIPTOR (1.10): class Video
ENDPOINT DESCRIPTOR
INTERFACE DESCRIPTOR (1.11): class Video
ENDPOINT DESCRIPTOR
INTERFACE DESCRIPTOR (2.0): class Application Specific
DFU Descriptor: DFU FUNCTIONAL

No.     Time           Source                Destination           Protocol Length Info
     15 0.018304       host                  3.1.0                 USBHUB   64     GET_STATUS Request     [Port 9]

Frame 15: 64 bytes on wire (512 bits), 64 bytes captured (512 bits) on interface usbmon3, id 0
USB URB
Setup Data

No.     Time           Source                Destination           Protocol Length Info
     16 0.018323       3.1.0                 host                  USBHUB   68     GET_STATUS Response    [Port 9]

Frame 16: 68 bytes on wire (544 bits), 68 bytes captured (544 bits) on interface usbmon3, id 0
USB URB
Port Status: 0x0107, PORT_CONNECTION, PORT_ENABLE, PORT_SUSPEND, PORT_POWER
Port Change: 0x0000

No.     Time           Source                Destination           Protocol Length Info
     17 0.018437       host                  3.1.0                 USBHUB   64     CLEAR_FEATURE Request  [Port 9: PORT_SUSPEND]

Frame 17: 64 bytes on wire (512 bits), 64 bytes captured (512 bits) on interface usbmon3, id 0
USB URB
Setup Data

No.     Time           Source                Destination           Protocol Length Info
     18 0.048502       60.38.44.143          172.232.161.40        TCP      54     [TCP Keep-Alive] 28168 → 49914 [ACK] Seq=0 Ack=0 Win=8192 Len=0

Frame 18: 54 bytes on wire (432 bits), 54 bytes captured (432 bits) on interface unknown, id 1
Ethernet II, Src: c7:36:2c:3e:7f:f8 (c7:36:2c:3e:7f:f8), Dst: ca:2f:ca:fc:64:ba (ca:2f:ca:fc:64:ba)
    Destination: ca:2f:ca:fc:64:ba (ca:2f:ca:fc:64:ba)
        Address: ca:2f:ca:fc:64:ba (ca:2f:ca:fc:64:ba)
        .... ..1. .... .... .... .... = LG bit: Locally administered address (this is NOT the factory default)
        .... ...0 .... .... .... .... = IG bit: Individual address (unicast)
    Source: c7:36:2c:3e:7f:f8 (c7:36:2c:3e:7f:f8)
    Type: IPv4 (0x0800)
Internet Protocol Version 4, Src: 60.38.44.143, Dst: 172.232.161.40
Transmission Control Protocol, Src Port: 28168, Dst Port: 49914, Seq: 0, Ack: 0, Len: 0
    Source Port: 28168
    Destination Port: 49914
    [Stream index: 0]
    [Conversation completeness: Complete, WITH_DATA (31)]
    [TCP Segment Len: 0]
    Sequence Number: 0    (relative sequence number)
    Sequence Number (raw): 0
    [Next Sequence Number: 0    (relative sequence number)]
    Acknowledgment Number: 0    (relative ack number)
    Acknowledgment number (raw): 0
    0101 .... = Header Length: 20 bytes (5)
    Flags: 0x010 (ACK)
    Window: 8192
    [Calculated window size: 8192]
    [Window size scaling factor: -2 (no window scaling used)]
    Checksum: 0xa80b [unverified]
    [Checksum Status: Unverified]
    Urgent Pointer: 0
    [Timestamps]
    [SEQ/ACK analysis]

No.     Time           Source                Destination           Protocol Length Info
     19 0.059619       3.1.0                 host                  USBHUB   64     CLEAR_FEATURE Response [Port 9: PORT_SUSPEND]

Frame 19: 64 bytes on wire (512 bits), 64 bytes captured (512 bits) on interface usbmon3, id 0
USB URB

No.     Time           Source                Destination           Protocol Length Info
     20 0.059710       3.1.1                 host                  USB      66     URB_INTERRUPT in

Frame 20: 66 bytes on wire (528 bits), 66 bytes captured (528 bits) on interface usbmon3, id 0
USB URB
Leftover Capture Data: 0002

No.     Time           Source                Destination           Protocol Length Info
     21 0.059730       host                  3.1.1                 USB      64     URB_INTERRUPT in

Frame 21: 64 bytes on wire (512 bits), 64 bytes captured (512 bits) on interface usbmon3, id 0
USB URB

No.     Time           Source                Destination           Protocol Length Info
     22 0.101704       host                  3.1.0                 USBHUB   64     GET_STATUS Request     [Port 9]

Frame 22: 64 bytes on wire (512 bits), 64 bytes captured (512 bits) on interface usbmon3, id 0
USB URB
Setup Data

No.     Time           Source                Destination           Protocol Length Info
     23 0.101748       3.1.0                 host                  USBHUB   68     GET_STATUS Response    [Port 9]

Frame 23: 68 bytes on wire (544 bits), 68 bytes captured (544 bits) on interface usbmon3, id 0
USB URB
Port Status: 0x0103, PORT_CONNECTION, PORT_ENABLE, PORT_POWER
Port Change: 0x0004, C_PORT_SUSPEND

No.     Time           Source                Destination           Protocol Length Info
     24 0.101895       host                  3.1.0                 USBHUB   64     CLEAR_FEATURE Request  [Port 9: C_PORT_SUSPEND]

Frame 24: 64 bytes on wire (512 bits), 64 bytes captured (512 bits) on interface usbmon3, id 0
USB URB
Setup Data

No.     Time           Source                Destination           Protocol Length Info
     25 0.101950       3.1.0                 host                  USBHUB   64     CLEAR_FEATURE Response [Port 9: C_PORT_SUSPEND]

Frame 25: 64 bytes on wire (512 bits), 64 bytes captured (512 bits) on interface usbmon3, id 0
USB URB

No.     Time           Source                Destination           Protocol Length Info
     26 0.113777       host                  3.4.0                 USB      64     GET STATUS Request

Frame 26: 64 bytes on wire (512 bits), 64 bytes captured (512 bits) on interface usbmon3, id 0
USB URB
Setup Data

No.     Time           Source                Destination           Protocol Length Info
     27 0.113919       3.4.0                 host                  USB      66     GET STATUS Response

Frame 27: 66 bytes on wire (528 bits), 66 bytes captured (528 bits) on interface usbmon3, id 0
USB URB
wStatus: 0x0000

No.     Time           Source                Destination           Protocol Length Info
     28 0.114050       host                  3.1.0                 USBHUB   64     GET_STATUS Request     [Port 9]

Frame 28: 64 bytes on wire (512 bits), 64 bytes captured (512 bits) on interface usbmon3, id 0
USB URB
Setup Data

No.     Time           Source                Destination           Protocol Length Info
     29 0.114075       host                  3.4.0                 USB      64     GET DESCRIPTOR Request DEVICE

Frame 29: 64 bytes on wire (512 bits), 64 bytes captured (512 bits) on interface usbmon3, id 0
USB URB
Setup Data

No.     Time           Source                Destination           Protocol Length Info
     30 0.114086       3.1.0                 host                  USBHUB   68     GET_STATUS Response    [Port 9]

Frame 30: 68 bytes on wire (544 bits), 68 bytes captured (544 bits) on interface usbmon3, id 0
USB URB
Port Status: 0x0103, PORT_CONNECTION, PORT_ENABLE, PORT_POWER
Port Change: 0x0000

No.     Time           Source                Destination           Protocol Length Info
     31 0.114316       3.4.0                 host                  USB      82     GET DESCRIPTOR Response DEVICE

Frame 31: 82 bytes on wire (656 bits), 82 bytes captured (656 bits) on interface usbmon3, id 0
USB URB
DEVICE DESCRIPTOR

No.     Time           Source                Destination           Protocol Length Info
     32 0.114488       host                  3.4.0                 USB      64     GET DESCRIPTOR Request CONFIGURATION

Frame 32: 64 bytes on wire (512 bits), 64 bytes captured (512 bits) on interface usbmon3, id 0
USB URB
Setup Data

No.     Time           Source                Destination           Protocol Length Info
     33 0.114760       3.4.0                 host                  USB      73     GET DESCRIPTOR Response CONFIGURATION

Frame 33: 73 bytes on wire (584 bits), 73 bytes captured (584 bits) on interface usbmon3, id 0
USB URB
CONFIGURATION DESCRIPTOR

No.     Time           Source                Destination           Protocol Length Info
     34 0.114960       host                  3.4.0                 USB      64     GET DESCRIPTOR Request CONFIGURATION

Frame 34: 64 bytes on wire (512 bits), 64 bytes captured (512 bits) on interface usbmon3, id 0
USB URB
Setup Data

No.     Time           Source                Destination           Protocol Length Info
     35 0.115623       3.4.0                 host                  USB      126    GET DESCRIPTOR Response CONFIGURATION

Frame 35: 126 bytes on wire (1008 bits), 126 bytes captured (1008 bits) on interface usbmon3, id 0
USB URB
CONFIGURATION DESCRIPTOR
INTERFACE DESCRIPTOR (0.0): class Vendor Specific
UNKNOWN DESCRIPTOR
ENDPOINT DESCRIPTOR
ENDPOINT DESCRIPTOR
ENDPOINT DESCRIPTOR
ENDPOINT DESCRIPTOR
ENDPOINT DESCRIPTOR

No.     Time           Source                Destination           Protocol Length Info
     36 0.115950       host                  3.1.0                 USBHUB   64     GET_STATUS Request     [Port 10]

Frame 36: 64 bytes on wire (512 bits), 64 bytes captured (512 bits) on interface usbmon3, id 0
USB URB
Setup Data

No.     Time           Source                Destination           Protocol Length Info
     37 0.116010       3.1.0                 host                  USBHUB   68     GET_STATUS Response    [Port 10]

Frame 37: 68 bytes on wire (544 bits), 68 bytes captured (544 bits) on interface usbmon3, id 0
USB URB
Port Status: 0x0107, PORT_CONNECTION, PORT_ENABLE, PORT_SUSPEND, PORT_POWER
Port Change: 0x0000

No.     Time           Source                Destination           Protocol Length Info
     38 0.116137       host                  3.1.0                 USBHUB   64     CLEAR_FEATURE Request  [Port 10: PORT_SUSPEND]

Frame 38: 64 bytes on wire (512 bits), 64 bytes captured (512 bits) on interface usbmon3, id 0
USB URB
Setup Data

No.     Time           Source                Destination           Protocol Length Info
     39 0.136851       172.232.161.40        60.38.44.143          TCP      54     [TCP Keep-Alive] 49914 → 28168 [ACK] Seq=0 Ack=0 Win=8192 Len=0

Frame 39: 54 bytes on wire (432 bits), 54 bytes captured (432 bits) on interface unknown, id 1
Ethernet II, Src: d6:0e:55:ce:03:3c (d6:0e:55:ce:03:3c), Dst: 79:77:34:c7:38:b9 (79:77:34:c7:38:b9)
    Destination: 79:77:34:c7:38:b9 (79:77:34:c7:38:b9)
        Address: 79:77:34:c7:38:b9 (79:77:34:c7:38:b9)
        .... ..0. .... .... .... .... = LG bit: Globally unique address (factory default)
        .... ...1 .... .... .... .... = IG bit: Group address (multicast/broadcast)
    Source: d6:0e:55:ce:03:3c (d6:0e:55:ce:03:3c)
        Address: d6:0e:55:ce:03:3c (d6:0e:55:ce:03:3c)
        .... ..1. .... .... .... .... = LG bit: Locally administered address (this is NOT the factory default)
        .... ...0 .... .... .... .... = IG bit: Individual address (unicast)
    Type: IPv4 (0x0800)
Internet Protocol Version 4, Src: 172.232.161.40, Dst: 60.38.44.143
Transmission Control Protocol, Src Port: 49914, Dst Port: 28168, Seq: 0, Ack: 0, Len: 0
    Source Port: 49914
    Destination Port: 28168
    [Stream index: 0]
    [Conversation completeness: Complete, WITH_DATA (31)]
    [TCP Segment Len: 0]
    Sequence Number: 0    (relative sequence number)
    Sequence Number (raw): 0
    [Next Sequence Number: 0    (relative sequence number)]
    Acknowledgment Number: 0    (relative ack number)
    Acknowledgment number (raw): 0
    0101 .... = Header Length: 20 bytes (5)
    Flags: 0x010 (ACK)
    Window: 8192
    [Calculated window size: 8192]
    [Window size scaling factor: -2 (no window scaling used)]
    Checksum: 0xa80b [unverified]
    [Checksum Status: Unverified]
    Urgent Pointer: 0
    [Timestamps]
    [SEQ/ACK analysis]

No.     Time           Source                Destination           Protocol Length Info
     40 0.157918       3.1.0                 host                  USBHUB   64     CLEAR_FEATURE Response [Port 10: PORT_SUSPEND]

Frame 40: 64 bytes on wire (512 bits), 64 bytes captured (512 bits) on interface usbmon3, id 0
USB URB

No.     Time           Source                Destination           Protocol Length Info
     41 0.158004       3.1.1                 host                  USB      66     URB_INTERRUPT in

Frame 41: 66 bytes on wire (528 bits), 66 bytes captured (528 bits) on interface usbmon3, id 0
USB URB
Leftover Capture Data: 0004

No.     Time           Source                Destination           Protocol Length Info
     42 0.158038       host                  3.1.1                 USB      64     URB_INTERRUPT in

Frame 42: 64 bytes on wire (512 bits), 64 bytes captured (512 bits) on interface usbmon3, id 0
USB URB

No.     Time           Source                Destination           Protocol Length Info
     43 0.194095       172.232.161.40        60.38.44.143          TCP      54     [TCP Retransmission] 49914 → 28168 [FIN, ACK] Seq=0 Ack=0 Win=8192 Len=0

Frame 43: 54 bytes on wire (432 bits), 54 bytes captured (432 bits) on interface unknown, id 1
Ethernet II, Src: 64:14:b5:9e:cd:df (64:14:b5:9e:cd:df), Dst: 10:03:95:5e:3f:bd (10:03:95:5e:3f:bd)
    Destination: 10:03:95:5e:3f:bd (10:03:95:5e:3f:bd)
        Address: 10:03:95:5e:3f:bd (10:03:95:5e:3f:bd)
        .... ..0. .... .... .... .... = LG bit: Globally unique address (factory default)
        .... ...0 .... .... .... .... = IG bit: Individual address (unicast)
    Source: 64:14:b5:9e:cd:df (64:14:b5:9e:cd:df)
        Address: 64:14:b5:9e:cd:df (64:14:b5:9e:cd:df)
        .... ..0. .... .... .... .... = LG bit: Globally unique address (factory default)
        .... ...0 .... .... .... .... = IG bit: Individual address (unicast)
    Type: IPv4 (0x0800)
Internet Protocol Version 4, Src: 172.232.161.40, Dst: 60.38.44.143
Transmission Control Protocol, Src Port: 49914, Dst Port: 28168, Seq: 0, Ack: 0, Len: 0
    Source Port: 49914
    Destination Port: 28168
    [Stream index: 0]
    [Conversation completeness: Complete, WITH_DATA (31)]
    [TCP Segment Len: 0]
    Sequence Number: 0    (relative sequence number)
    Sequence Number (raw): 0
    [Next Sequence Number: 1    (relative sequence number)]
    Acknowledgment Number: 0    (relative ack number)
    Acknowledgment number (raw): 0
    0101 .... = Header Length: 20 bytes (5)
    Flags: 0x011 (FIN, ACK)
    Window: 8192
    [Calculated window size: 8192]
    [Window size scaling factor: -2 (no window scaling used)]
    Checksum: 0xa80a [unverified]
    [Checksum Status: Unverified]
    Urgent Pointer: 0
    [Timestamps]
    [SEQ/ACK analysis]

No.     Time           Source                Destination           Protocol Length Info
     44 0.199870       host                  3.1.0                 USBHUB   64     GET_STATUS Request     [Port 10]

Frame 44: 64 bytes on wire (512 bits), 64 bytes captured (512 bits) on interface usbmon3, id 0
USB URB
Setup Data

No.     Time           Source                Destination           Protocol Length Info
     45 0.199930       3.1.0                 host                  USBHUB   68     GET_STATUS Response    [Port 10]

Frame 45: 68 bytes on wire (544 bits), 68 bytes captured (544 bits) on interface usbmon3, id 0
USB URB
Port Status: 0x0103, PORT_CONNECTION, PORT_ENABLE, PORT_POWER
Port Change: 0x0004, C_PORT_SUSPEND

No.     Time           Source                Destination           Protocol Length Info
     46 0.200059       host                  3.1.0                 USBHUB   64     CLEAR_FEATURE Request  [Port 10: C_PORT_SUSPEND]

Frame 46: 64 bytes on wire (512 bits), 64 bytes captured (512 bits) on interface usbmon3, id 0
USB URB
Setup Data

No.     Time           Source                Destination           Protocol Length Info
     47 0.200110       3.1.0                 host                  USBHUB   64     CLEAR_FEATURE Response [Port 10: C_PORT_SUSPEND]

Frame 47: 64 bytes on wire (512 bits), 64 bytes captured (512 bits) on interface usbmon3, id 0
USB URB

No.     Time           Source                Destination           Protocol Length Info
     48 0.211877       host                  3.5.0                 USB      64     GET STATUS Request

Frame 48: 64 bytes on wire (512 bits), 64 bytes captured (512 bits) on interface usbmon3, id 0
USB URB
Setup Data

No.     Time           Source                Destination           Protocol Length Info
     49 0.212178       3.5.0                 host                  USB      66     GET STATUS Response

Frame 49: 66 bytes on wire (528 bits), 66 bytes captured (528 bits) on interface usbmon3, id 0
USB URB
wStatus: 0x0003

No.     Time           Source                Destination           Protocol Length Info
     50 0.212352       host                  3.5.0                 USB      64     CLEAR FEATURE Request

Frame 50: 64 bytes on wire (512 bits), 64 bytes captured (512 bits) on interface usbmon3, id 0
USB URB
Setup Data

No.     Time           Source                Destination           Protocol Length Info
     51 0.212541       3.5.0                 host                  USB      64     CLEAR FEATURE Response

Frame 51: 64 bytes on wire (512 bits), 64 bytes captured (512 bits) on interface usbmon3, id 0
USB URB

No.     Time           Source                Destination           Protocol Length Info
     52 0.212961       host                  3.5.1                 USB      64     URB_INTERRUPT in

Frame 52: 64 bytes on wire (512 bits), 64 bytes captured (512 bits) on interface usbmon3, id 0
USB URB

No.     Time           Source                Destination           Protocol Length Info
     53 0.212984       host                  3.1.0                 USBHUB   64     GET_STATUS Request     [Port 10]

Frame 53: 64 bytes on wire (512 bits), 64 bytes captured (512 bits) on interface usbmon3, id 0
USB URB
Setup Data

No.     Time           Source                Destination           Protocol Length Info
     54 0.213008       host                  3.5.2                 USB      64     URB_BULK in

Frame 54: 64 bytes on wire (512 bits), 64 bytes captured (512 bits) on interface usbmon3, id 0
USB URB

No.     Time           Source                Destination           Protocol Length Info
     55 0.213027       host                  3.5.2                 USB      64     URB_BULK in

Frame 55: 64 bytes on wire (512 bits), 64 bytes captured (512 bits) on interface usbmon3, id 0
USB URB

No.     Time           Source                Destination           Protocol Length Info
     56 0.213029       3.1.0                 host                  USBHUB   68     GET_STATUS Response    [Port 10]

Frame 56: 68 bytes on wire (544 bits), 68 bytes captured (544 bits) on interface usbmon3, id 0
USB URB
Port Status: 0x0103, PORT_CONNECTION, PORT_ENABLE, PORT_POWER
Port Change: 0x0000

No.     Time           Source                Destination           Protocol Length Info
     57 0.213280       host                  3.5.0                 USB      64     GET DESCRIPTOR Request DEVICE

Frame 57: 64 bytes on wire (512 bits), 64 bytes captured (512 bits) on interface usbmon3, id 0
USB URB
Setup Data

No.     Time           Source                Destination           Protocol Length Info
     58 0.213534       3.5.0                 host                  USB      82     GET DESCRIPTOR Response DEVICE

Frame 58: 82 bytes on wire (656 bits), 82 bytes captured (656 bits) on interface usbmon3, id 0
USB URB
DEVICE DESCRIPTOR

No.     Time           Source                Destination           Protocol Length Info
     59 0.213609       host                  3.5.0                 USB      64     GET DESCRIPTOR Request CONFIGURATION

Frame 59: 64 bytes on wire (512 bits), 64 bytes captured (512 bits) on interface usbmon3, id 0
USB URB
Setup Data

No.     Time           Source                Destination           Protocol Length Info
     60 0.213857       3.5.0                 host                  USB      73     GET DESCRIPTOR Response CONFIGURATION

Frame 60: 73 bytes on wire (584 bits), 73 bytes captured (584 bits) on interface usbmon3, id 0
USB URB
CONFIGURATION DESCRIPTOR

No.     Time           Source                Destination           Protocol Length Info
     61 0.213928       host                  3.5.0                 USB      64     GET DESCRIPTOR Request CONFIGURATION

Frame 61: 64 bytes on wire (512 bits), 64 bytes captured (512 bits) on interface usbmon3, id 0
USB URB
Setup Data

No.     Time           Source                Destination           Protocol Length Info
     62 0.214428       3.5.0                 host                  USB      264    GET DESCRIPTOR Response CONFIGURATION

Frame 62: 264 bytes on wire (2112 bits), 264 bytes captured (2112 bits) on interface usbmon3, id 0
USB URB
CONFIGURATION DESCRIPTOR
INTERFACE DESCRIPTOR (0.0): class Wireless Controller
ENDPOINT DESCRIPTOR
ENDPOINT DESCRIPTOR
ENDPOINT DESCRIPTOR
INTERFACE DESCRIPTOR (1.0): class Wireless Controller
ENDPOINT DESCRIPTOR
ENDPOINT DESCRIPTOR
INTERFACE DESCRIPTOR (1.1): class Wireless Controller
ENDPOINT DESCRIPTOR
ENDPOINT DESCRIPTOR
INTERFACE DESCRIPTOR (1.2): class Wireless Controller
ENDPOINT DESCRIPTOR
ENDPOINT DESCRIPTOR
INTERFACE DESCRIPTOR (1.3): class Wireless Controller
ENDPOINT DESCRIPTOR
ENDPOINT DESCRIPTOR
INTERFACE DESCRIPTOR (1.4): class Wireless Controller
ENDPOINT DESCRIPTOR
ENDPOINT DESCRIPTOR
INTERFACE DESCRIPTOR (1.5): class Wireless Controller
ENDPOINT DESCRIPTOR
ENDPOINT DESCRIPTOR
INTERFACE DESCRIPTOR (1.6): class Wireless Controller
ENDPOINT DESCRIPTOR
ENDPOINT DESCRIPTOR

No.     Time           Source                Destination           Protocol Length Info
     63 0.216879       60.38.44.143          172.232.161.40        TCP      59     28168 → 49914 [PSH, ACK] Seq=0 Ack=0 Win=8192 Len=5

Frame 63: 59 bytes on wire (472 bits), 59 bytes captured (472 bits) on interface unknown, id 1
Ethernet II, Src: 9f:53:63:e4:00:f3 (9f:53:63:e4:00:f3), Dst: 6b:a8:66:a3:53:2f (6b:a8:66:a3:53:2f)
    Destination: 6b:a8:66:a3:53:2f (6b:a8:66:a3:53:2f)
        Address: 6b:a8:66:a3:53:2f (6b:a8:66:a3:53:2f)
        .... ..1. .... .... .... .... = LG bit: Locally administered address (this is NOT the factory default)
        .... ...1 .... .... .... .... = IG bit: Group address (multicast/broadcast)
    Source: 9f:53:63:e4:00:f3 (9f:53:63:e4:00:f3)
    Type: IPv4 (0x0800)
Internet Protocol Version 4, Src: 60.38.44.143, Dst: 172.232.161.40
Transmission Control Protocol, Src Port: 28168, Dst Port: 49914, Seq: 0, Ack: 0, Len: 5
    Source Port: 28168
    Destination Port: 49914
    [Stream index: 0]
    [Conversation completeness: Complete, WITH_DATA (31)]
    [TCP Segment Len: 5]
    Sequence Number: 0    (relative sequence number)
    Sequence Number (raw): 0
    [Next Sequence Number: 5    (relative sequence number)]
    Acknowledgment Number: 0    (relative ack number)
    Acknowledgment number (raw): 0
    0101 .... = Header Length: 20 bytes (5)
    Flags: 0x018 (PSH, ACK)
    Window: 8192
    [Calculated window size: 8192]
    [Window size scaling factor: -2 (no window scaling used)]
    Checksum: 0x842c [unverified]
    [Checksum Status: Unverified]
    Urgent Pointer: 0
    [Timestamps]
    [SEQ/ACK analysis]
    TCP payload (5 bytes)
Data (5 bytes)

0000  48 65 6c 6c 6f                                    Hello

No.     Time           Source                Destination           Protocol Length Info
     64 0.241491       60.38.44.143          172.232.161.40        TCP      54     28168 → 49914 [ACK] Seq=0 Ack=0 Win=8192 Len=0

Frame 64: 54 bytes on wire (432 bits), 54 bytes captured (432 bits) on interface unknown, id 1
Ethernet II, Src: c9:c1:d1:0c:42:e7 (c9:c1:d1:0c:42:e7), Dst: f8:e1:17:48:1c:b5 (f8:e1:17:48:1c:b5)
    Destination: f8:e1:17:48:1c:b5 (f8:e1:17:48:1c:b5)
        Address: f8:e1:17:48:1c:b5 (f8:e1:17:48:1c:b5)
        .... ..0. .... .... .... .... = LG bit: Globally unique address (factory default)
        .... ...0 .... .... .... .... = IG bit: Individual address (unicast)
    Source: c9:c1:d1:0c:42:e7 (c9:c1:d1:0c:42:e7)
    Type: IPv4 (0x0800)
Internet Protocol Version 4, Src: 60.38.44.143, Dst: 172.232.161.40
Transmission Control Protocol, Src Port: 28168, Dst Port: 49914, Seq: 0, Ack: 0, Len: 0
    Source Port: 28168
    Destination Port: 49914
    [Stream index: 0]
    [Conversation completeness: Complete, WITH_DATA (31)]
    [TCP Segment Len: 0]
    Sequence Number: 0    (relative sequence number)
    Sequence Number (raw): 0
    [Next Sequence Number: 0    (relative sequence number)]
    Acknowledgment Number: 0    (relative ack number)
    Acknowledgment number (raw): 0
    0101 .... = Header Length: 20 bytes (5)
    Flags: 0x010 (ACK)
    Window: 8192
    [Calculated window size: 8192]
    [Window size scaling factor: -2 (no window scaling used)]
    Checksum: 0xa80b [unverified]
    [Checksum Status: Unverified]
    Urgent Pointer: 0
    [Timestamps]

No.     Time           Source                Destination           Protocol Length Info
     65 0.278897       60.38.44.143          172.232.161.40        TCP      54     [TCP Retransmission] 28168 → 49914 [FIN, ACK] Seq=0 Ack=0 Win=8192 Len=0

Frame 65: 54 bytes on wire (432 bits), 54 bytes captured (432 bits) on interface unknown, id 1
Ethernet II, Src: 5b:58:cd:41:23:d0 (5b:58:cd:41:23:d0), Dst: 45:d6:00:5b:83:15 (45:d6:00:5b:83:15)
    Destination: 45:d6:00:5b:83:15 (45:d6:00:5b:83:15)
        Address: 45:d6:00:5b:83:15 (45:d6:00:5b:83:15)
        .... ..0. .... .... .... .... = LG bit: Globally unique address (factory default)
        .... ...1 .... .... .... .... = IG bit: Group address (multicast/broadcast)
    Source: 5b:58:cd:41:23:d0 (5b:58:cd:41:23:d0)
    Type: IPv4 (0x0800)
Internet Protocol Version 4, Src: 60.38.44.143, Dst: 172.232.161.40
Transmission Control Protocol, Src Port: 28168, Dst Port: 49914, Seq: 0, Ack: 0, Len: 0
    Source Port: 28168
    Destination Port: 49914
    [Stream index: 0]
    [Conversation completeness: Complete, WITH_DATA (31)]
    [TCP Segment Len: 0]
    Sequence Number: 0    (relative sequence number)
    Sequence Number (raw): 0
    [Next Sequence Number: 1    (relative sequence number)]
    Acknowledgment Number: 0    (relative ack number)
    Acknowledgment number (raw): 0
    0101 .... = Header Length: 20 bytes (5)
    Flags: 0x011 (FIN, ACK)
    Window: 8192
    [Calculated window size: 8192]
    [Window size scaling factor: -2 (no window scaling used)]
    Checksum: 0xa80a [unverified]
    [Checksum Status: Unverified]
    Urgent Pointer: 0
    [Timestamps]
    [SEQ/ACK analysis]

No.     Time           Source                Destination           Protocol Length Info
     66 0.351057       172.232.161.40        60.38.44.143          TCP      59     49914 → 28168 [PSH, ACK] Seq=0 Ack=0 Win=8192 Len=5

Frame 66: 59 bytes on wire (472 bits), 59 bytes captured (472 bits) on interface unknown, id 1
Ethernet II, Src: c5:6b:e0:b7:cd:38 (c5:6b:e0:b7:cd:38), Dst: 75:8f:24:ae:8d:a9 (75:8f:24:ae:8d:a9)
    Destination: 75:8f:24:ae:8d:a9 (75:8f:24:ae:8d:a9)
        Address: 75:8f:24:ae:8d:a9 (75:8f:24:ae:8d:a9)
        .... ..0. .... .... .... .... = LG bit: Globally unique address (factory default)
        .... ...1 .... .... .... .... = IG bit: Group address (multicast/broadcast)
    Source: c5:6b:e0:b7:cd:38 (c5:6b:e0:b7:cd:38)
    Type: IPv4 (0x0800)
Internet Protocol Version 4, Src: 172.232.161.40, Dst: 60.38.44.143
Transmission Control Protocol, Src Port: 49914, Dst Port: 28168, Seq: 0, Ack: 0, Len: 5
    Source Port: 49914
    Destination Port: 28168
    [Stream index: 0]
    [Conversation completeness: Complete, WITH_DATA (31)]
    [TCP Segment Len: 5]
    Sequence Number: 0    (relative sequence number)
    Sequence Number (raw): 0
    [Next Sequence Number: 5    (relative sequence number)]
    Acknowledgment Number: 0    (relative ack number)
    Acknowledgment number (raw): 0
    0101 .... = Header Length: 20 bytes (5)
    Flags: 0x018 (PSH, ACK)
    Window: 8192
    [Calculated window size: 8192]
    [Window size scaling factor: -2 (no window scaling used)]
    Checksum: 0x7a22 [unverified]
    [Checksum Status: Unverified]
    Urgent Pointer: 0
    [Timestamps]
    [SEQ/ACK analysis]
    TCP payload (5 bytes)
Data (5 bytes)

0000  57 6f 72 6c 64                                    World

No.     Time           Source                Destination           Protocol Length Info
     67 0.392251       106.35.174.137        40.205.38.236         ICMP     42     Echo (ping) reply    id=0x0000, seq=0/0, ttl=64

Frame 67: 42 bytes on wire (336 bits), 42 bytes captured (336 bits) on interface unknown, id 1
Ethernet II, Src: cb:dd:1f:03:46:eb (cb:dd:1f:03:46:eb), Dst: 64:a4:3b:f3:e7:ed (64:a4:3b:f3:e7:ed)
    Destination: 64:a4:3b:f3:e7:ed (64:a4:3b:f3:e7:ed)
        Address: 64:a4:3b:f3:e7:ed (64:a4:3b:f3:e7:ed)
        .... ..0. .... .... .... .... = LG bit: Globally unique address (factory default)
        .... ...0 .... .... .... .... = IG bit: Individual address (unicast)
    Source: cb:dd:1f:03:46:eb (cb:dd:1f:03:46:eb)
    Type: IPv4 (0x0800)
Internet Protocol Version 4, Src: 106.35.174.137, Dst: 40.205.38.236
Internet Control Message Protocol

No.     Time           Source                Destination           Protocol Length Info
     68 0.488315       60.38.44.143          172.232.161.40        TCP      54     28168 → 49914 [ACK] Seq=0 Ack=0 Win=8192 Len=0

Frame 68: 54 bytes on wire (432 bits), 54 bytes captured (432 bits) on interface unknown, id 1
Ethernet II, Src: 30:6c:5b:69:18:f1 (30:6c:5b:69:18:f1), Dst: 02:4d:56:de:c5:4b (02:4d:56:de:c5:4b)
    Destination: 02:4d:56:de:c5:4b (02:4d:56:de:c5:4b)
        Address: 02:4d:56:de:c5:4b (02:4d:56:de:c5:4b)
        .... ..1. .... .... .... .... = LG bit: Locally administered address (this is NOT the factory default)
        .... ...0 .... .... .... .... = IG bit: Individual address (unicast)
    Source: 30:6c:5b:69:18:f1 (30:6c:5b:69:18:f1)
        Address: 30:6c:5b:69:18:f1 (30:6c:5b:69:18:f1)
        .... ..0. .... .... .... .... = LG bit: Globally unique address (factory default)
        .... ...0 .... .... .... .... = IG bit: Individual address (unicast)
    Type: IPv4 (0x0800)
Internet Protocol Version 4, Src: 60.38.44.143, Dst: 172.232.161.40
Transmission Control Protocol, Src Port: 28168, Dst Port: 49914, Seq: 0, Ack: 0, Len: 0
    Source Port: 28168
    Destination Port: 49914
    [Stream index: 0]
    [Conversation completeness: Complete, WITH_DATA (31)]
    [TCP Segment Len: 0]
    Sequence Number: 0    (relative sequence number)
    Sequence Number (raw): 0
    [Next Sequence Number: 0    (relative sequence number)]
    Acknowledgment Number: 0    (relative ack number)
    Acknowledgment number (raw): 0
    0101 .... = Header Length: 20 bytes (5)
    Flags: 0x010 (ACK)
    Window: 8192
    [Calculated window size: 8192]
    [Window size scaling factor: -2 (no window scaling used)]
    Checksum: 0xa80b [unverified]
